{"fixture":{"artifact":"D","root":"root-87e01d35c37ee7f98c5a190a06140687252965f6ce93249f06b46e517fb22562"},"id":"H8","name":"policy-weakening","note":"The implementation APPLIES the recipe to the named frozen fixture and emits observations. No SHA-256 produced by any implementation is recorded here; after the reveal two implementations compute them independently and a disagreement is a FINDING.","predicates":[{"op":"REFUSAL_SET_EQ","value":["nest-policy-weakened"]}],"recipe":[{"op":"CHECK_WITH_OPTIONS","options":{"max_depth":1000}}]}