{"fixture":{"artifact":"D","root":"root-87e01d35c37ee7f98c5a190a06140687252965f6ce93249f06b46e517fb22562"},"id":"H3","name":"operand-ordered-permutation","note":"The implementation APPLIES the recipe to the named frozen fixture and emits observations. No SHA-256 produced by any implementation is recorded here; after the reveal two implementations compute them independently and a disagreement is a FINDING.","predicates":[{"op":"MOVES","path":"D.nested_claim_sem_id"},{"op":"VERDICT_EQ","path":"D.verdict","value":"VERIFIED"}],"recipe":[{"op":"REVERSE","path":"artifact.claim.operands"},{"op":"REVERSE","path":"artifact.references.operands"},{"note":"recompute nested_claim_sem_id, aggregate_id, structure_sem_id","op":"RESEAL"}]}