{"fixture":{"artifact":"C1","root":"root-377d77c33137bdeb7ccd366b14ec13d6eead55e662524d5f8e2ee92de9895af4"},"id":"H7","name":"duplicate-json-member-on-the-wire","note":"The implementation APPLIES the recipe to the named frozen fixture and emits observations. No SHA-256 produced by any implementation is recorded here; after the reveal two implementations compute them independently and a disagreement is a FINDING.","predicates":[{"op":"OUTCOME_EQ","path":"resolve.outcome","value":"non-canonical-wire"}],"recipe":[{"name":"protocol","note":"serve these octets under C1's own root","op":"WIRE_PREPEND_DUPLICATE_MEMBER","value":"EVIL"}]}