{"fixture":{"artifact":"C2","root":"root-7c7b4ca5e888ba076411a1e317a21264b856226986b718da02c0e77ca33baaed"},"id":"H5","name":"deeper-diamond-shared-child","note":"The implementation APPLIES the recipe to the named frozen fixture and emits observations. No SHA-256 produced by any implementation is recorded here; after the reveal two implementations compute them independently and a disagreement is a FINDING.","predicates":[{"op":"VERDICT_EQ","path":"C2.verdict","value":"VERIFIED"},{"op":"EQ","path":"candidate.C2.structure.edges","value":4},{"op":"EQ","path":"candidate.C2.structure.unique_artifacts","value":3},{"op":"EQ","path":"candidate.C2.structure.max_depth_below","value":2},{"op":"EQ","path":"candidate.C2.structure.films_below_by_edge_multiplicity","value":266},{"op":"EQ","path":"candidate.C2.structure.films_below_distinct","value":138},{"op":"EQ","path":"candidate.C2.structure.cases_below_by_edge_multiplicity","value":144},{"op":"EQ","path":"candidate.C2.structure.cases_below_distinct","value":80}],"recipe":[{"op":"IDENTITY"}]}