{"fixture":{"leaf":"TRVM-BOUNDED-PROOF-v1","root":"root-b5b33778522764c7af9f30b22f3d7e1e3900064a6d2c0ab99d8b6d5aba39b65b"},"id":"H1","name":"annotation-only-leaf-change","note":"The implementation APPLIES the recipe to the named frozen fixture and emits observations. No SHA-256 produced by any implementation is recorded here; after the reveal two implementations compute them independently and a disagreement is a FINDING.","predicates":[{"op":"HOLDS","path":"leaf.verified_claim_sem_id"},{"op":"MOVES","path":"leaf.artifact_root"},{"op":"HOLDS","path":"D.nested_claim_sem_id"},{"op":"MOVES","path":"D.artifact_root"},{"op":"VERDICT_EQ","path":"D.verdict","value":"VERIFIED"}],"recipe":[{"op":"SET","path":"leaf.annotations.holdout_note","value":"H1"},{"note":"rebuild D = C2 ∧ C1, C2 = C1 ∧ A, C1 = A ∧ B","op":"RECOMPOSE_DAG"}]}